1608f92c002ef7f2de1ba82576a74370; Poll source Sample size Margin of error Date(s) administered 
179aadfc77f07ecc46e60ba4539e806a; Poll source Sample size Margin of error Date(s) administered 
a51df1b82a11c9cfeeebef25d14e6d2c; Poll source Sample size Margin of error Date(s) administered 
c34c9faae605c32899e434562fd52d5d; Poll source Sample size Margin of error Date(s) administered 
cea9eac38c8c4a0b083d2f89eedfb765; Poll source Sample size Margin of error Date(s) administered 
dd4186c92a3d82cdd2252562d2c79b17; Poll source Sample size Margin of error Date(s) administered 
eb87a1aef900debfd394c51bc07e6f32; Poll source Sample size Margin of error Date(s) administered 
